,,,,
Date,Abortion,Infanticide,Concealed Pregnancy,Text 
1676-12-13,1.0,,,"THe first person tried, was for making away her Bastard-childe ; but upon hearing the Evidence, and examination both of the Midwife and Coroner, it appeared tobe onely a Miscarriage; and by several circumstances there was reason to judge that she had not gone above sixteen weeks, and had never been quick, the abortive Infant being not above eight inches long, and no symptoms of Wounds or Bruises being to be seen, on the body to argue any violence used to it, he Jury thereupon thought fit to bring her in not guilty ."
1677-16-01,,1.0,,"After this was the Tryal of a Midwife of the Parish of St. Giles Cripplegate , who was Indicted by her self, and immediately after two very aged poor women being Searcher s towards Wapping Indicted jointly for murdering a certain male Child by choaking the same with their hands, &c. Some account has already been given in Print of this business, but very false and imperfect, upon full Evidence it appeared only to be thus. This Midwife whether to satisfie her Husband (as she now alleadges) who was very Impatient to have a child, or whether it were to preserve her credit in her imploy which she thought somwhat prejudiced by the imputation of barrenness, I cannot say, but so it was she resolved to pretend to have a Child, in order hereunto by wearing a small Pillow, &c. she had perswaded many of her neighbors that she was great, and about a week before her pretended Labour enquired very earnestly of a poor Woman if she could not help her to a young Child as soon almost as born, either alive or dead, For says she there is a Lady whose husband will not live with her because she never had a Child, and he is now in the Country and if I could get a Child, I should do a good office in rendering love between them, and get something my self, but this Woman as she now swore, refused not knowing how to assist her; whereupon it seems she applied her self to the two searchers of Whitechappel, who having gratified her extravagant desires, on the 18. of April our Midwife pretends to fall in labour, but would not let any of the women touch her; and having dismist all save one in the Chamber, when she was got to bed, pretending great pains, her friend offering to put her hands into the Bed for better satisfying her self of her condition, she cried out Murder! Murder! Which raising a further suspicion in the woman, she did at last take out of the Bed a cold naked dead Child, which had, as appeared, been wrapt up in a Cloth, and seemed to have been a day or two old; whereupon she told the Prisoner this could be none of her child, who wickedly replyed with a horrid Curse and Imprecation on her self, if it were not her own child, born of her own body: However, Neighbours being called, several sober Matrons now deposed, that having searched her, they were confident she had no child at all, and that this was some other persons child, &c. The Prisoner being demanded where she had the child, declared of the two Searchers, which they being called to the Bar acknowledged, and that they brought it to her the same day, and had 20s. being promised 9l. more: That they had it on Saltpeter Bank. The Mother appeared in Court, and her Midwife, who testified it to be still born, and that they coming to search it, and seeing her a very poor woman, told her they would save her the charge of a Burial, &c. But the Mother denyed she had any money for it: Upon full examination of all which no suspicion of murder appearing, but only a strange extravagant humour, both the Midwife and two Searchers were by the Jury brought in Not Guilty of the several Indictments whereof they stood charged."
1677-06-09,,1.0,,"THe first person that received Trial this Sessions, was a young Woman for the horrid Crime of Murder, charged to have been unnaturally committed on her own Female bastard Child , on the 17th of July last: She had been for some time suspected to be with child, but it did not appear any body had burthen'd her therewith. She was delivered alone, and had laid the Child in a Trunk; but being very sick, a woman (at whose house she lay) upon some suspicion sent for a Midwife, who declaring that she had had a Child, the now Prisoner at last confest it, and they found it lockt up in the Trunk as aforesaid. The Prisoner alleadged it was still-born, and upon view of the Body there did not appear the least mark of wound, bruise, or other violence used: So that thereupon, and her voluntary Confession, &c. the Jury not believing that she had actually murdered the Infant, brought her in Not guilty ."
1679-04-30,,1.0,,"THe Sessions beginning on Wednesday, a young woman was tried for Murthering her (supposed) Bastard-childe . Being Servant in a Victualing-house , a Fellow living in the same house, accidentally found something under the stairs wrapt up in a Cloth; which upon opening proved to be a young naked Childe; which had lain so long there, (six or eight weeks, as it was supposed) that 'twas putrified. Hereupon the Prisoner was suspected that it might be hers, and search'd by a Midwife and some Matrons, who were of opinion that she had a Childe, but not so lately: And indeed she confess'd, she had a year or two ago, a little one, but affirmed, that she was then married, and absolutely denied that she knew any thing of this Childe. Wherefore there being no proof that it was hers, and for that, being a publick house, it was possible it might be laid there by another, she was acquitted ."
1679-10-15,,1.0,,"The next seemed to be an object of Compassion to most People present, a poor young Wench lodging about Thames street, betrayed (as she alleadged by a promise of Marriage and getting her with Child, which being perceived by the Woman that she lodged with, to whom she confessed the truth thereof, just when she came to fall in Labour about 9 or 10 a Clock in the Night, this etous woman, fearing some charge or trouble might happen to her, who had entertain'd her, cruelly turned her out of doors, and set her in another Parish, and there left her in pains, telling her that now the said Parish were bound to provide for her. In this sad condition in the street, and without any help was this poor Creature delivered, and being found lying as one half dead by the watch, and her condition perceived; a midwife was called, who found the Child dead, but not separated from her Body , when she came to her; who asking her if it were still-born, the Prisoner both then and now said, it was not, for she heard it, cry, but denied that she intended or used any wilful means to make away the Life of it nor did there any signs of Violence appear save only some little spots or marks of a Bruse or Pinch on the Throat, which some conceive might be occasion'd Involuntarily in struggling to Promote its Birth; by an ignorant Woman in her circumstances: however being a Bastard Child, and the law makeing it death in that case for any woman to be delivered alone without calling help, she was thereupon found Guilty . [Death. See summary.]"
1681-04-13,,1.0,,"ANN Price was Arraigned and Tried for felloniously Murthering her Bastard Male-Infant in the Parish of St. Margaret's Westminster ; the circumstances thus, She having lived in the nature of a Servant with a Gentlewoman; as she confessed, was got with Child by a Man that was her fellow Servant; and carried it so cuningly, that no Person in the house did in the least suspect her till after she was delivered, which was without help, when wraping the Child in an Apron. She locked it up in her Box; and rising betimes in the Morning, made a Fire and went to Bed again; so that her Mistris finding her out of order, began to examine the cause; whereupon supspecting what had happen'd, she got a Midwife, who uponinquiry found she had been delivered; the which she stoutly denied, but at last confessed she had, the Child being still Born, and that she had locked it in her Box. where it was accordingly found, this being sworn by the Witness; her Answer was, That she finding her pains come fast upon her: knocked with her shoo, as loud as possible, but could make none hear her, by reason she lay up three pair of stairs; but the concealing of the Child, being a material Point of Evidence against her; upon the reciting the Statute, she was found guilty of Murther. [Death. See summary.]"
1681-05-20,,1.0,,"Elizabeth Messenger , was tryed upon an Indictment of Murther for making away her Bastard male Infant , the manner of which was, that the Prisoner being a Servant , by too much Familiarity with a Fellow that promised her Marriage proved with Chid, the which she carried so close that none perceived it, and being delivered alone, she got up betimes the next Morning and hid her Child under certain Boards, in a Cellar, but being very Ill, her Mistriss suspected her, and sending for a Midwife found she had been Delivered, the which she notwithstanding denied for a good Space: But in conclusion Confessed it and shewed them where she had disposed of it, it being taken, up a small Orifice was found in the Breast on 't. So that after the Reading of the Statute of King James, made for the prevention of such Murthers she was found Guilty of the Murthering of the said Infant. [Death. See summary.]"
1687-05-12,1.0,,,"Ann Wood , of the Parish of St. Giles's Cripple-gate , was Tryed for Murthering her Bastard Male Infant, on the 25th. of April last , against whom, upon Tryal it appeared that she had been delivered of a Child but at twice, viz. First of the Body, and afterward of the Head; yet it being look'd upon by the Midwife, who was assistant to her, that it was an Abortive Birth, and she wanted so much of her time, that the Infant was altogether imperfect, and consequently not alive, the Jury Acquitted her."
1687-05-12,,1.0,,"M - S - took her Tryal for Murthering her Male Bastard Infant, on the 26th. of April last ; the proof was, that she had had a Child which was found dead in her Chamber; yet she not attempting to conceal it, but on the contrary had been to bespeak a Midwife, at whose house she intended as she said to Lye in, and nothing appearing to the contrary but that it might be Born Dead, she was Acquitted ."
1688-01-13,1.0,1.0,,"Sinah Jones , of the Parish of St. Mary Woolnoth , was Indicted for Murdering her Bastard Male Child, on the Eighteenth of December last, being Saturday Night, by stopping its Breath with a Cloath put in its Mouth ; she being a Servant in the House of Mr. Cousins. The Evidence against her was plain, the Nurse, the Chair-woman, the Midwife, the Master and his Servant, all deposing, that she denying the Key, they broke open her Trunk, where they all saw the Child Dead, wrapped up in a Cloath, with a Rag in the Mouth of it, as big as a Handkerchief, and that the Child being something Warm, they tried all they could to recover Life in it, but to no purpose. The Prisoner said little for herself, but that she knew nothing of the Cloath in the Mouth of the Child, and that she had not her Senses; and was Light-headed. Then the Statute was read to her, wherein, If the Child be found Dead and, Concealed, though it were so Born, the Person Concealing it, shall suffer Death as in case of Murder, except she can prove by one Witness at least, that the Child so Concealed was Born Dead. Upon full Evidence, she was brought in guilty of Murder. [Death. See summary.]"
1689-12-11,,1.0,,"Mary Campion was Indicted for smothering her Female Infant Bastard Child , on the first of Decemb. The Evidence deposed, that the Child was found Dead in a Box under the Prisoners Bed, and that she owned it to be hers: and the Child was full grown, and no appearance of hurt was seen on the Child, as was Evidenced by the Midwife. The Prisoner said, that she was not near her time; and no proof was made that the Child was Born alive; and she being found to make good Provision for the Child against the Birth, she was deemed to be out of the Statute, so she was Acquitted ."
1691-04-22,,1.0,,"Elizabeth Deal , was tryed for the Murther of her Female Infant Bastard Child , on the 7th of March last, on this wise, She went to a Midwife at Stepney , and desired to Lye In in private, which the Midwife promised she should, if she would make provision for the Child, which she promised, but did not, but privately made away the Child, throwing it into a Puddle of Water on the backside of the House, in the High-way. She confessing (when taken) that the Child Gasped when it was thrown down; adding that it cryed, and then she pinched it by the Throat and dispatcht it out of the World; this she confest to several Women about her, but upon her Tryal she denyed all, and pleaded that she was Distracted, but never laid any violent Hands upon her Child, neither did she put it into the Water, not pinch it, only what she did was to cover her Shame, begging hard that the Court would pitty her sad Condition She was found Guilty of wilful Murther. [Death. See summary.]"
1696-02-27,,1.0,,"M - S - of the Parish of Saint Giles's in the Fields , was indicted for murthering her Female Infant Bastard on the 29th of December last, by putting it into a Trunk, whereby it was smothered . It appeared that she was brought to bed on a Sunday morning and complained that she was very ill, and her Mistress and some women more came to her, and charged her with it, which she denied at first, but finding Milk in her Breast, she was very unwilling to own it, but confessed at last where it was. When the Statute was read, she confessed that she was not married, and that when she was delivered, she cried out, and that she was in a great Trance, and did believe that the Child was dead born; her Master and Mistress said that they had heard something of it, but could not believe it till she was brought to bed; the Prisoner likewise declared that she had taken care to get a Midwife and a Nurse to look after her, when she should come from her Master, which she did expect would be in a little time after, she having given her Master warning to be gone; the Jury considering the same, found her not guilty ."
1696-09-09,,1.0,1.0,"Margaret Price of the Parish of Istleworth , was Indicted for the Murther of her Female Bastard Child , on the first of July last. It appeared that the Churchwardens of the Parish suspecting that she was with Child, she lately having a great Belly, seemed as if she had lost it, they sent their Beadle and a Midwife to search her; the Midwife taking some Women with her went to her, and she confessed that she had miscarried, and had thrown it into a Cart-rutt. But it was further observed that she was so far gone, that it could not be put there; they searched about, and in the Garden, under a little Dunghil, they found the Child hid, which they did think was at its full time. The Prisoner could not deny the Fact, but said that it was born dead, she having hurt her self, and that she did cry, out when she was delivered, but could not prove it. The Jury found her guilty of Murther. [Death -respited for pregnancy. See summary.]"
1696-12-09,,1.0,,"Mary Ingerley of the Parish of St. Giles's in the Fields , was Indicted for the Murder of her Male Bastard Infant , on the 9th of October last. The Prisoner declared that she had a Husband, and that the Child was no Bastard. She called the Midwife, who declared that she did think that the Child was dead Born, by reason that the Skin was torn. The Jury acquitted her."
1697-07-07,,1.0,,"Elinor Hunt was indicted for the Murther of her Female Infant Bastard on the 24th of June last, by throwing the same into a House of Office, by which means it was choaked . It appeared that the Prisoner was a Servant at Bosomes Inn; one of the Evidence said that she was afraid that she had left some of her Goods, and went up Stairs, where she saw some signs which made her to mistrust her; there was another Evidence that said that she did lie with her, and she complained that she was not well, and about Three a Clock in the Morning she went down to the Vault, and when she came up, she went to Bed; after some time that she was mistrusted, they searcht and in the House of Office they found the Child, then they sent for a Midwife, who examined her about it, and she confest the matter to her: The Prisoner said that the Child was Stilborn, and that she had Eight Weeks to go of her time, and had no design to murther it. The Jury having considered the matter, found her guilty . [Death. See summary.]"
1702-01-14,,1.0,,"Christian Russel , of the Parish of St. Pauls Covent Garden , was indicted for the Murther of her Male Infant Bastard, on the 19th of December last, by throwing the same into a House of Office . The first Evidence was her Mistress, who deposed, That the Prisoner was a Servant in the House, and in the Morning, it being the Fast-day, she came down and sat by the Kitchen-fire, and told her Mistress she was not well, upon which, she bid her go up Stairs, which she did; about 2 a Clock she came to see her again, and then she said that she was something better, upon which, she askt her to hire a Chare-woman for that Day, (which she did) and said, that she did hope to be better the next Day to do her work her self; a while after she did mistrust that she had had a Child, and askt her if she was married, and she answered No, then she said, What have you done with the Child; and she confest that it was in the House of Office. She farther deposed, That when she saw the Child the next Day, that the Arm of it was broke; and did believe that it was come to its full time. The next Evidence was the Chare-woman, who said, That she took the Child out of the Vault, and when she found it, there was two pieces of Brickbats lay upon the Breast of it. The Midwife also deposed, That it was very likely that the Child was alive Born, by reason it was a very large Child, and came to its full time; and said, she found no Marks about it, only that the Arm was broke. The Prisoner called a Witness to prove that she had provided Things for a Lying-in, which she sent to her Sisters, where they were found after she was delivered: She also said, That she had a great Fall about a Fortnight before, which hurt her very much, and that she never felt the Child to stir afterwards, but she could not prove that ever she had made any one acquainted with her Condition. The Jury found her guilty . [Death. See summary.]"
1704-03-08,,1.0,,"Jane Lyne , of the Parish of St. Michael Basishaw , was indicted for the Murther of her Male Infant Bastard, by throwing it into an House of Office, whereby it was strangled, on the 20th of February last . The first Evidence deposed, That the Prisoner lodged in the House, and perceiving that she was with-Child, askt her if she was a Wife, or a Widow, by reason she looked so big? and whether she was with-Child? And she replyed, No; and told her, that she was troubled with a Timpany and Dropsie. Some time after the Prisoner made an inquiry whether the Vault run into the Common-Shore? saying, it was never emptied. After that, she had occasion to wash some Things, upon which she perceived her to be very Lank, and told her Husband, who mistrusting her about her Words about the Vault, searched, and found the Child wrapt up in a Cloath, and put into a Lining of his Sleeve: After that he sent for a Constable, who carried her that Night to the Compter, and the next Day being brought before the Justice, owned that she had a Child, but was in an Error, and did not kill it, for it was Still-born. There was other Evidences, who deposed, That they did discover something of such Matters when she washt her Linnen; and also in the room where she lay, there was other symptoms discovered, as if she had been delivered there: And other Evidences, who also said, That she had Milk in great abundance in her Breast: And a Midwife declared [Pages missing in original.]"
1711-12-05,,1.0,,"Phebe Ward , of St. Clement's-Danes , was indicted for the Murther of her Female Bastard Child , on the 21st of November last. The first Evidence was one that liv'd in the House with her, and that the Morning before she was deliver'd, she complain'd she had the Cholick very much; but being ask'd by this Deponent, whether it was not something else? She said, No. She further ask'd her, whether she had never known Man? She said, no, never in her life. Some time after that she ask'd her how she did? She said she was very ill. She then ask'd her again, if she was not with Child, telling her that she was not the first that had been drawn away; and if she was, her Mistress would take Care of her, that she should Lye in handsomely. She still deny'd it; and this Deponent farther said, that she gave her two Cordial Drams, and that about an hour after that she ask'd her how she did? she said she was much better; but desir'd her to keep the Candle out of her Eyes. Coming up a second time she found some tokens of a Delivery, she taxes her with having a Child, pulling down the Bed-cloaths to the feet, but did not see any Child. The next Morning this Deponent coming down, saw the Footsteps of a Person, and trac'd it, quite to the Vault; upon this she told her Mistress, who caus'd the Vault to be search'd, and there the Child was found. There was another Evidence, who was Clerk of the Parish, who saw the Child taken out of the Vault, and that it was a full grown Child. There was another Witness,who took the Child out of the Vault; and also another who was the Midwife, who searching of her, found she had been delivered of a Child. The Prisoner in her defence said very little, and it appearing that she had made no Provision for it; the Jury found her Guilty . [Death. See summary.]"
1712-01-11,,1.0,,"Anne Nichols was indicted for Murder, and upon the Coroner's Inquest for murdering her Female Bastard Child , on the 5th instant. The Evidence was her Mistress, a Midwife, who depos'd, That on the Dry aforesaid Nichols being up earlier than usual, she coming into the Kitchen, saw an Alteration in her face, and having a Suspicion, felt her Breasts, and told her she was sure she had been newly deliver'd of a Child; which the Prisoner immediately confess'd, and said the Child was in a Box in her Chamber, where it was found. The Child was at its full growth; but her Mistress, with another Midwife who was Evidence, gave some Reasons why in their Judgment the Child was stillborn; nor did there appear any Marks of Violence. The Prisoner said, When her Pains came upon her, she got out of Bed, but fell into a Swoon, and was not able to call for Help; and it appearing she had made some Provision for her Bying-in, the Jury acquitted her."
1714-06-30,,1.0,,"Mary Tate of the Parish of St. Martin in the Fields , was indicted for the Murder of her Male Bastard Child , on the 12th of May last. It appear'd by the Evidence, That she was found lying the Fields in a languishing Condition, and being taken care of by the Parish-Officers, she told them she had been deliver'd of Child, and had rapt it in Straw, and left it by a Pond-side, being robb'd of the Cloaths she had provided for it, as she came from Cirencester in Gloucstershire, whereupon a midwife being sent for, to examine the Matter, found she had been deliver'd. the Prisoner being afterwards remov'd to the Round house, pretended to go and shew the Place where she had left her child; and when she came to a Brick kiln near Tyburn Road, told the Woman who went along with her, that after she had put her Child in Straw, she thrust it into the hole of the Kiln while it was burning. She deny'd all at her Tryal, and talk'd very ramblingly; and several Winesses appearing, who gave an Account that she had been look'd upon as a Person not well in her Senses for some Years, she was acquitted ."
1715-09-07,,1.0,,"Jane Simpson , of the Parish of Hackney , was indicted for the Murder of her Bastard Male Child , on the Second of August last. She was also indicted on the Coroner's Inquest for the said Murder. Anne Harrison depos'd, That hearing the Prisoner cry out, she came to her, and ask'd her what was the Matter, who answering nothing ; she look'd under the Bed, and found a Cloth, and in it a dead Child: The Midwife, and some other Women saw the Child, but believ'd it might be born in the after Birth. The Prisoner said she made some Provision for the Birth, and that it was born dead; and no Body proving any thing to the contrary, she was acquitted ."
