,,,,
1737-10-12,,1.0,,"600. Jane Trigg . spinster , was indicted for the murder of her female bastard child , July 1 . and she stood charged on the coroner's inquisition for the said murder. William Glover . I live at Sunbury, in Middlesex . My back yard comes against the prisoner's necessary house. On Sunday the first of July I got up about 6 o'clock, and opened my backdoor. I heard a groaning . I had occasion to go into my own necessary house. The time I was there, I heard this groaning continually. Then I went near. I heard a person speaking to the prisoner who was in her necessary house. The prisoner said, I have been prodigious bad all night with the cholic and pain in my bowels. I don't take upon me to swear to the voice ; but I think it was the prisoner. I thought no more of it till a child was found on the Wednesday morning in this necessary house. Then there came William Johnson , Thomas Gunter , John King , and John Hillier , to my house, and desired I'd let them go into my back yard, to see if there was a child in that vault. I had flung a great heap of dirt to keep the filth from coming through. They dug that away. Then they saw a child, I did not go with them; they came and told me what they saw, and desired I'd lend them something to get it out. I lent them a garden how, with which they took it out, and brought it to my house. There was a bruise on one side of the head. It was a female child. It was reported about the town, the prisoner was with child before this. Thomas Gunter and William Johnson deposed to their taking the child out of the Vault, and washing it; and that it was reported some time that the prisoner was with child. Jane Reading . I live under the same roof the prisoner does, I was going to the pump this Sunday morning. I saw the prisoner sitting in the necessary house. She groaned, and said, it was a sad thing to have her bowels so bad. I said, so it is. She got off and went in a-doors. I went out about my business. When I came back again about 8 o'clock, I found the house very still. Some time after her mother came home. I asked her how her daughter did. She said, she was indifferent. After that, I observed the necessary house clean washed. On the Wednesday morning I got a candle and looked down the necessary house, and there I saw a young child lie, then I made it known Richard Stephens . I am a Surgeon, and live at this same town. Hearing a female child was found in a bog house, on Friday the 6th of July, I went to see the child. I did not observe any marks of violence on it. It was a fine full grown child. I opened the chest of it, and took out the right lobe of the lungs, and put it into Water. That induced me to believe the child was born alive ; for that swam. Had the child never breathed, the lungs would have sunk. Q. Is it possible a woman might be deliver'd of such a child as this, by a sudden surprize, while she is sitting on the necessary house? Stevens. It is very improbable. Q. Is it possible? Stevens. I think it is next to impossible. Q. Are you a man-midwife ? Stevens. No, my lord, I am not. Q. Have you never heard of things of this kind coming by surprize? Stevens. No, Sir. Q. Suppose a woman should be taken with violent pains, while sitting in that manner? whether or no a child may not come from her immediately? Stevens. It is very improbable. Q. Does not such sort of disorder occassion the person sometimes to want to go to stool? Stevens. I never heard of such a thing. Q. Did you never hear of a woman going cross a room, and, upon some sudden surprize, bring forth a child directly? Stevens. I never knew an instance of it. Q. to Jane Reading . Was there any thing appeared at that time, that could induce you to believe the prisoner was deliver'd ? J Reading . I saw nothing. Q. Did you hear a child cry? J Reading . I did not. Acquitted ."
1739-09-06,,1.0,,"108. (M.) , a single woman , was indicted for the murder of her female bastard child , Jan. 16 .* John Jones. I live at Knightsbridge , the prisoner was servant to Dr. Clark who lodged in my house: On the 16th of Jan. about three in the morning. I got up in order to go to brewing; I traced some marks of blood from the kitchen stairs to the necessary house, and seeing much blood there, I put down my lanthorn and candle, and discovered a child lying. I got a chissel and iron crow, and wrenched up the floor, and by the help of a dung hook I got the child up; then I and my servant maid went and washed it at the pump; it was a female child; I observed it lay partly on its back with the head buried in the soil. We could see no cuts, or scars, or marks of violence on it. I then carried it and laid it on a table in the back kitchen, and then sent for Mr. Fisher, a surgeon, and a midwife, who is here to give evidence; they came, and I desired they'd inspect the child to see if there was any thing to be found from whence they might imagine that the child came by its death; they searched it in my sight, and declared they found no marks of violence upon it; it seemed to me to be very near its full time. I thought I had seen children newly born more perfect, there being very little hair on its head, and the nails on its fingers not so big as on newborn children I have seen; it was a small child. By the position the child lay in it might have come from her as she sat on the vault, for the head was downwards, and seemed to be a good deal buried in the soil. I also observed what follows the child lying near its feet, or betwixt the legs, and the navel-string was found to be broke, not cut, about five or six inches from the child's body; a good deal of blood had gone down the vault, more than I perceived any where else. Q. Was it drops of blood you had observed on the floor from the stairs? Jones. It was rather smear'd blood that seem'd to be done by a woman's bottom of her petticoats, and I am very well assured it was done by a person returning from the vault, for the blood was daubed against the under part of the stairs, which, had it been done by coming down, would have been on the tops of the stairs; I make no doubt but it was done in the return. I went to Dr. Clark and told him what I had seen, and that I thought it was by somebody belonging to him. The prisoner had complained of a purging on her two or three days before this. Q. Had you any suspicion of the prisoner being big before? Jones. No, I had not. My wife went up stairs to the prisoner, and brought down two or three little things for a child, which she said she had been making at different times when her master was out of the way. Produced in court a shirt, some caps, and other things. I had, after this, some talk with my wife, who said it was possible that the child might insensibly slip from her in her pain as she was on the vault, and it is usual for women to want to go to the close-stool oftener at such a Time than usual. She said such accidents had often happened to women where they have had all the help at hand. Mrs. Littlewood. I am a midwife, and was sent for upon this occasion on the 16th of January, about six in the morning, I was told how the child was found, and desired to look at it, to see whether it had been thrown in or dropt there accidentally; I observed the navel string to have been broke, I saw no marks of violence on the child; I went up and saw the prisoner, and by examining her found that she had had a child. I asked her if she was married, she said no; my opinion is that the child was at its time. She had a shirt, a cap, and other things for it, which I saw. Q Have you heard what Mr. Jones has said as to a conversation with his wife? Littlewood. I have, and she is right; such cases often happen to married sober women: a woman who had the same accident sent for me about three months ago. I was satisfied from all I heard or saw, that there was no murder committed in the case. For the Prisoner. Mrs. Clark. When this child was found I went and ask'd the prisoner if she had provided any things for it, and she said I should find some in such a drawer; I went, and taking out a bundle found the little things that have been here produced. Acquitted ."
1740-04-16,,1.0,,"190. (M.) Ann Hullock , single woman , was indicted for the willful murder of her female bastard infant , April 8 . She likewise stood charg'd on the coroner's inquest for the said murder.* Susannah Dorwood . I am a midwife; I was sent for to Mrs. Dudman's; she told me she was afraid that Nanny was brought to bed, and the child was killed; I took a candle and look'd down the vault, and saw a child's feet; I went directly up stairs to the prisoner, and said Nanny, why could you put the child down the vault; she said she did not; this was between 9 and 10 o'clock in the morning; I told her she did, and told her I saw a plain proof that she had been delivered, and had put the child down the vault; then she attempted to make me believe it dropp'd from her body in the vault; I had found she had been delivered on the boards in the vault; at last she told me she did; I went to Mrs. Dudman, and desir'd she would let me take the child out of the soil; she said, she was afraid she should come into trouble; I said, the jury could not sit till it was taken out; I went and took it out; the minute I got it up at the he ad of the vault the blood appear'd: I said here is murder committed, the head is almost off; I laid it down on the boards, and it bled prodigiously. Q. How long had it lain in the vault, as near as you can guess? S. Dorwood. I believe it might have been born between 3 and 4 in that morning; it stuck in the soil, and the soil kept the place together, so that the blood had no vent; I went up stairs directly; I said Nanny, how could you lay violent hands on it to draw innocent blood, said I, do you consider you soul? she made no answer; I said, where is your pocket? she said it was down stairs; I put my hand under her bed, and found her pocket, but there was no knife in it; then I asked her where the knife was, with which she committed the murder; she said in the knife-box; I ask'd what knife; she said one of her mistress's case knives; I look'd in the box, but looking on the other dresser I found the knife, that I suppose to be the knife with blood upon it. Q. Did the child appear to you to have come to the birth? S. Dorwood. It did. Q. In your opinion was the child born alive? S. Dorwood. Yes. Q. Where was this? S. Dorwood. It was at Paddington. Q. Did you examine the body of the prisoner? S. Dorwood. No, I did not, because every thing was safe from her body. Q. Was it a male or female child? S. Dorwood. It was a female. Jane Dudman . The prisoner was servant to a lodger of mine, she seem'd to be big with child; she had been but a fortnight in my house; when she had not been in my house above a week there was some grease upon the floor, I desir'd her to get it up; she down on her knees, and as she stoop'd, I said you are a good servant, but I fear you are spoil'd; I said are you marry'd (she appear'd very big) she said no, she never was married in her life. I was in my bed, and heard a person coming down early in the morning; I call'd who is there 2 or 3 times, at last I call'd aloud; she answer'd, it is me; are not you well, said I? no said she I am not well: I heard her go down stairs, and open the yard door; she was out some time. I was very uneasy. She did not come in; I got up and open'd the sash, and call'd to her; she said yes, Madam, I am a great deal better, I will come in presently; I believe she had been in the yard something less than a quarter of an hour. Q. Where was she when she answer'd you? J. Dudman. She was then in the necessaryhouse; then I went to bed, and did not go to sleep, I was afraid she would fall to pieces there; presently I heard the yard door open, she went into the kitchen, and open'd the window, I went to sleep; when my husband got up, my maid came up to me and said, Madam, I am frighted out of my wits, I am afraid Nanny has miscarry'd, she has mopp'd up the place in the necessaryhouse, and the kitchen too. Q. Is you maid here? J. Dudman. No, she is not; there was a person that lay in our house that night, and he said to me, there is something that should not be; my husband bid me go and see; I went, and saw a bad thing had been done: then my husband sent for a constable, and order'd me to lend for a midwife, which I did; then I went up stairs to the prisoner's mistress, and begg'd of her to go with me to the maid; she made us believe she was asleep; I shook her, and call'd to her, and ask'd her what wicked deed she had been doing, where is your child? at last she said it was down in the vault. I had seen the child before, but afterwards I saw the child's throat was cut. I said to her, how could you do this, there is an hospital ready, and if you had spoke to me but half an hour before I could have got it in. She never own'd to me that she had laid violent hands on it. John Gibbs . I am constable; I was sent for to the house of Mrs. Dudman. She told me, she was afraid her lodger's servant had been deliver'd of a child in the little house, and that she had made away with it, the child was taken out of the soil, and I saw it with the head almost cut off. I went in, and ask'd where the girl was; I went to her and said, was the child born alive. She said yes. I said, did it cry? she said yes. I said, what could be the reason of your murdering of it? she said, she did not know what to do with it. I said, have you any cloaths for it? she said, no. Said I, you will be hang'd. She said, O Lord, I hope not. Said I, is it your child? she said yes. I said, how did you murder it? with a case knife, said she. I ask'd her where the knife was? she said, in the kitchen. I talk'd to her a good deal, and ask'd her if she was in her senses; she said she was very well for the time, and that she was able to get up and do her business. I went down stairs and ask'd for the knife, and there I was show'd it. The next morning I apply'd to justice Fielding, and ask'd what I should do with her? he said, by all means fetch her, if she is able to be removed, there is one subject lost. don't let another be lost without punishment. I went and fetch'd her, and she confess'd the same before the justice; in the coach between there and justice Fielding's she never denied the fact; but said, she always intended to put it in the necessary. It was a female child (a case knife produc'd with blood upon it) Prisoner's defence. I did not intend to do it, I took the knife with me with intent to part the burden from the child; I never heard it cry as I am here alive. When I found what I had done I put it in the vault; I was by myself in the vault. Guilty . Death . She receiv'd sentence immediately (this being thursday) to be executed on the saturday, and her body to be diffected and anatomis'd."
1742-12-08,,1.0,,"Jane Bostock , of St. Mary Whitechapel , was indicted, for that she not having the Fear of God before her Eyes, but being led by the Malice and Instigation of the Devil, did on the 7th of February Inst. kill and murder her Infant male Bastard Child, of which she was then privately deliver'd . Dorothy Hill depos'd, That she lodg'd at the House of one Mrs. Burgess, to whom the Prisoner was then a Servant , when she was deliver'd of a Child, and that she seeing her come out of the Necessary House with a Mop and other Tokens, suspected her to have had a Child, and at 8 at Night she inform'd her Husband and a Neighbour, of her Suspicions, and the Neighbour, one Mrs. Bingley, found the Child in the Necessary House and took it up with a Stick. Mrs. Bingley depos'd, That she took the Child out of the Necessary House and wash'd it in a Pail of Water, when there did not appear any Marks of Cruelty about it. Elizabeth Burgess depos'd, That the Prisoner was her Servant, and that she had heard she was with Child, and tax'd her with it, but she denied it, that in the Afternoon before this Accident happen'd, she bid the Prisoner mend a Sheet, and while she was so employed, she herself fell asleep, and that when she awaked she was the Prisoner trundling a Mop near the House of Office, and calling her in she sent her of an Errand, when she found something that gave her no little uneasiness, and a great deal of Reason to believe that the Prisoner had been deliver'd of a Child, but when she return'd she would not confess it; however, she proceeded so far in her Searches as was a sufficient demonstration, when the Prisoner could deny it no longer, saying, she had really been deliver'd of a Child, and it was at a Neighbour's, but it was soon after found in the House of Office, and it appear'd to her that the Prisoner had gone her full Time, and that the Child had no Marks or Bruises as if any Violence had been offer'd to it. The Midwife likewise confirm'd this Part of the Evidence, and they all agreed; that she said it came from her in the House of Office, and she could not help its falling down, which the Midwife said was possible: The Jury brought in their Verdict Not Guilty ."
1743-04-13,,1.0,,"Sarah Harwood , alias Badger, alias Radford , was indicted for the Murder of her Male Bastard-Infant, by throwing it into a House of Office, where it was suffocated , the 8th of March last. She was also indicted a 2d Time on the Coroner's Inquest for the same. John Hanby , a Surgeon, depos'd, That he view'd the Child, and it did appear to be at its full Time, and to be Born alive; and that upon making Trial of a Piece of the Lungs put into Water, it was buoyant, and did not sink; and that he did not observe any visible Marks of Violence on the Child. Mary Cummins depos'd, That the Prisoner came the Night before the Fact to her, and ask'd her for a Lodging and gave her 3 d. for it; that she having no other Conveniency, she lay with another Lodger; that going into the Yard in the Morning, she perceiv'd some Drops of Blood, and going up to her Lodgers, enquir'd if any body had been down in the Yard whose Nose had bled? they all saying no; she took a Candle, and near the little Vault saw a great Quantity of Blood, and looking down the Hole, saw a Child; that going up and taxing the Prisoner with having murder'd her Child, she reply'd, she knew nothing of it; that then she went out for a Midwife, fastening the Doors after her; and when she came home the Prisoner was gone, having got on the top of the House, and so got into another House. Elizabeth Marclew depos'd, That the Prisoner lay in the same Bed with her that Night; that the Prisoner got up about 3 or 4 a-Clock in the Morning, and said she was grip'd, and ask'd for a Pot; she told her, there was one in such a Place; but she went down Stairs, and staid there about 3 quarters of an Hour, and came up again, and went into Bed, and that she heard neither Sigh nor Groan, nor any such thing, made by the Prisoner; nor were there any Signs upon the Stairs; that about 8 or 9 a-Clock the Prisoner was eating a Pennyworth of Milk, when Mrs. Cummins came up, and said the Child was found. Katherine Wall depos'd, That she took the Child out of the Vault, and wash'd it, and that on each Side of the Head, near the Ear, there was a black Spot, but she did believe they might be caus'd by her helping herself. Mary Eastwood , a Midwife, depos'd, That 4 Days after, she examining the Prisoner, found she had Milk in her Breasts, and that Plaisters were over them to dry it up. The Prisoner in her Defence pleaded, That she did not know she was so near her Time, and that she being at the necessary House, was taken very ill, and swoon'd, and was not sensible of the Child's dropping from her, and that she never laid her Finger upon it to hurt it, nor could remember how she got up Stairs again. Damaris Lamb depos'd, That the Prisoner came to her the Night before, desiring her to help her to a Lodging; that she sent her to Mrs. Cummins, and perceiving her Condition, gave her some odd Things, as Cotton for Sleeves, &c. and gave her also 6 d. in Money, and she said she had divers other Things at her Father's-in-Law at the Kings-Arms in Lawrence Lane in New St. Giles's. Upon a full Hearing of the Matter, the Jury found her guilty of the Indictment. Death ."
1743-10-12,,1.0,,"Martha Rickets , of St. Martin's in the Fields , was indicted for the Murther of her Male Bastard Infant the 5th of March , by throwing it into a House of Office . Sarah Miles depos'd, that she did see a New- born Infant taken out of the Vault by some Hand, but could not say by whose Hand it was; and she believed it had lain there three Weeks, and that the Prisoner did confess that her Master was the Father of it, and said that it dropt from her at the Vault; and that she also owned that she took it out with her own Hand, that she saw no Marks of Violence on it but one, which she supposed might be caused by poking in the Vault in having been stopt. Mary Dean , a Midwife, depos'd that afterward when the Prisoner was apprehended, and in the Round house, the Beadle came to her, that she went, and inquiring of the Prisoner she did not own, but for some Time deny'd that she had had a Child; but owned she had had a Miscarriage while she was in the Lord Bruce's Family some Months before; but upon being examined, she found she had a Child not long before that Time, and at length owned that the Child was behind a Washing-Tub in the Back-Kitchin; but she going to the House, could find no Child there; that afterward she said, it was buried under a Bench that the Washing-Tub stood upon; that she took a Grave-Digger, and he did dig up the Child, and after washing it, she did believe it to be at its full Time; that there was some Marks of Hurt upon it, but it seemed they might be occasioned by what had been depos'd by poking in the Vault, to remove some Stoppage in it. The taking up the Child was confirm'd by John Lee , the Grave- Digger. Other Evidences depos'd that the Prisoner had made some Provision of Linen for the Child, and the Things were produc'd in Court, and depos'd on Oath, that they fetch'd them by her Direction. The Prisoner deny'd the Fact, as to the Murther of the Child, and said, that she knew not that she was so near her Time and that it dropp'd from her at the Vault, when uncapable to help it. Upon a full Hearing of the Matter, the Jury acquitted her."
1744-05-10,,1.0,,"Elizabeth Smith , of St. Margaret's Westminster , was indicted for the Murther of her Female Bastard Infant, by throwing it into a Vault, by which it was suffocated and strangled , the 28th of July last. She was likewise indicted a second time on the Coroner's Inquest, for the felonious slaying the said Female Infant. Mary Mason depos'd, That she had suspected the Prisoner to be with Child two or three Months before, and had taxed her with it, but she deny'd it, and spoke to her Aunt about it; that the Prisoner being Fellow-Servant with her, she took Notice she was uneasy in the Night, in Bed, but lay till the usual time, and getting up, went to work; but perceiving her to go to the Vault more than once, she ask'd her, what ail'd her? She reply'd, she had a violent Looseness. That she went again to the Vault, which was a pretty way backwards and under-ground, that she might possibly cry out, and not be heard, but she did not hear her; that when she came back, she seeming very Ill, she ask'd, what was the Matter with her? She said, nothing; that thereupon she sent immediately for a Midwife, who having examined her, found she had had a Child; ask'd, where it was? She reply'd, it was in the Vault; that the Vault being search'd, the Child was taken out, but no Marks of Violence appeared upon it. Jane Hall, the Midwife, depos'd, That she being sent for, ask'd the Prisoner, if she had not had a Child? But she said nothing; and afterwards said, she was taken with a Pain in the Vault, and the Child dropp'd from her; that the Child being taken out, she wash'd it, and examin'd it, and found no Marks of Violence upon it, and that the Child was at its full time. This Evidence being ask'd, If it was not possible for a Woman to be so surprized as a Birth might happen after that manner? She reply'd, that it was. She being likewise ask'd, Whether the Prisoner made Provision for the Child? She reply'd, She found one Child's Cap in her Box, and had heard that there was more in another Place. Mary Smith depos'd, The Prisoner had brought to her Holland, and Things to make sit for a Child, which she produced in Court; after a full hearing of the Matter, the Jury acquitted her."
